Option,"Yes, and I am or plan to","Yes, but I am not or do not plan to","Yes, but I am not sure if I will","No, and I am not sure if I will","No, but I am or plan to","No, and for that reason, I am not or do not plan to","No, and I would not have wanted to even if I felt more prepared"
More than once a day,4,3,0,2,1,0,3
Once a day,33,20,5,3,6,3,7
Three to five times a week,49,37,9,6,24,16,15
Once or twice a week,91,60,20,10,23,19,14
Once or twice a month,36,35,12,9,18,8,19
Less than once a month,38,30,13,5,19,8,13
I have never masturbated,59,34,15,15,18,7,24
